{
  "$schema": "http://json-schema.org/draft-07/schema#",
  "type": "array",
  "minItems": 1,
  "uniqueItems": true,
  "items": {
    "type": "object",
    "properties": {
      "headers": {
        "type": "object",
        "properties": {
          "user-agent": {
            "type": "string"
          }
        }
      },
      "device": {
        "type": "object",
        "properties": {
          "deviceName": {
            "anyOf": [
              {
                "type": "string"
              },
              {
                "type": "null"
              }
            ]
          },
          "marketingName": {
            "anyOf": [
              {
                "type": "string"
              },
              {
                "type": "null"
              }
            ]
          },
          "manufacturer": {
            "type": "string"
          },
          "brand": {
            "type": "string"
          },
          "display": {
            "type": "object",
            "properties": {
              "width": {
                "anyOf": [
                  {
                    "type": "integer"
                  },
                  {
                    "type": "null"
                  }
                ]
              },
              "height": {
                "anyOf": [
                  {
                    "type": "integer"
                  },
                  {
                    "type": "null"
                  }
                ]
              },
              "touch": {
                "anyOf": [
                  {
                    "type": "boolean"
                  },
                  {
                    "type": "null"
                  }
                ]
              },
              "type": {
                "anyOf": [
                  {
                    "type": "string"
                  },
                  {
                    "type": "null"
                  }
                ]
              }
            },
            "required": [
              "width",
              "height",
              "touch",
              "type"
            ]
          },
          "dualOrientation": {
            "type": "boolean"
          },
          "type": {
            "type": "string"
          }
        },
        "required": [
          "deviceName",
          "marketingName",
          "manufacturer",
          "brand",
          "display",
          "dualOrientation",
          "type"
        ]
      },
      "browser": {
        "type": "object",
        "properties": {
          "name": {
            "anyOf": [
              {
                "type": "string"
              },
              {
                "type": "null"
              }
            ]
          },
          "modus": {
            "anyOf": [
              {
                "type": "null"
              },
              {
                "type": "integer"
              }
            ]
          },
          "version": {
            "type": "string"
          },
          "manufacturer": {
            "type": "string"
          },
          "bits": {
            "type": "integer"
          },
          "type": {
            "type": "string"
          }
        },
        "required": [
          "name",
          "modus",
          "version",
          "manufacturer",
          "bits",
          "type"
        ]
      },
      "os": {
        "type": "object",
        "properties": {
          "name": {
            "anyOf": [
              {
                "type": "string"
              },
              {
                "type": "null"
              }
            ]
          },
          "marketingName": {
            "anyOf": [
              {
                "type": "string"
              },
              {
                "type": "null"
              }
            ]
          },
          "version": {
            "type": "string"
          },
          "manufacturer": {
            "type": "string"
          },
          "bits": {
            "type": "integer"
          }
        },
        "required": [
          "name",
          "marketingName",
          "version",
          "manufacturer",
          "bits"
        ]
      },
      "engine": {
        "type": "object",
        "properties": {
          "name": {
            "anyOf": [
              {
                "type": "string"
              },
              {
                "type": "null"
              }
            ]
          },
          "version": {
            "type": "string"
          },
          "manufacturer": {
            "type": "string"
          }
        },
        "required": [
          "name",
          "version",
          "manufacturer"
        ]
      }
    },
    "required": [
      "headers",
      "device",
      "browser",
      "os",
      "engine"
    ]
  }
}