[
  {
    "headers": {
      "user-agent": "Mozilla/5.0 (X11; U; Linux i686; de-DE) AppleWebKit/534.3 (KHTML, like Gecko) WeTab-Browser Safari/534.3"
    },
    "device": {
      "deviceName": "WeTab",
      "marketingName": "WeTab",
      "manufacturer": "WeTab",
      "brand": "WeTab",
      "display": {
        "width": 1366,
        "height": 768,
        "touch": true,
        "type": "FWXGA",
        "size": null
      },
      "dualOrientation": true,
      "type": "tablet",
      "simCount": 0,
      "market": {
        "regions": [],
        "countries": [],
        "vendors": []
      },
      "connections": []
    },
    "browser": {
      "name": "WeTab Browser",
      "modus": null,
      "version": "0.0.0",
      "manufacturer": "Unknown",
      "bits": 32,
      "type": "browser"
    },
    "os": {
      "name": "MeeGo",
      "marketingName": "MeeGo",
      "version": "0.0.0",
      "manufacturer": "LinuxFoundation",
      "bits": 32
    },
    "engine": {
      "name": "WebKit",
      "version": "534.3.0",
      "manufacturer": "Apple"
    }
  }
]
