[
  {
    "headers": {
      "user-agent": "Mozilla/5.0 (Linux; Android 5.1; K107 Build/LMY47I; wv) AppleWebKit/537.36 (KHTML, like Gecko) Version/4.0 Chrome/58.0.3029.83 Safari/537.36"
    },
    "device": {
      "deviceName": "K107",
      "marketingName": "K107",
      "manufacturer": "Yuntab",
      "brand": "Yuntab",
      "type": "fone-pad",
      "display": {
        "width": 1280,
        "height": 800,
        "touch": true,
        "type": null
      },
      "dualOrientation": true
    },
    "browser": {
      "name": "Android WebView",
      "modus": null,
      "version": "58.0.3029.83",
      "manufacturer": "Google",
      "bits": 32,
      "type": "browser"
    },
    "os": {
      "name": "Android",
      "marketingName": "Android",
      "version": "5.1.0",
      "manufacturer": "Google",
      "bits": 32
    },
    "engine": {
      "name": "Blink",
      "version": "537.36.0",
      "manufacturer": "Google"
    }
  },
  {
    "headers": {
      "user-agent": "Mozilla/5.0 (Linux; Android 5.1; K17 Build/LMY47I) AppleWebKit/537.36 (KHTML, like Gecko) Chrome/67.0.3396.87 Safari/537.36"
    },
    "device": {
      "deviceName": "K17",
      "marketingName": "K17",
      "manufacturer": "Yuntab",
      "brand": "Yuntab",
      "type": "fone-pad",
      "display": {
        "width": 1280,
        "height": 800,
        "touch": true,
        "type": null
      },
      "dualOrientation": true
    },
    "browser": {
      "name": "Chrome",
      "modus": null,
      "version": "67.0.3396.87",
      "manufacturer": "Google",
      "bits": 32,
      "type": "browser"
    },
    "os": {
      "name": "Android",
      "marketingName": "Android",
      "version": "5.1.0",
      "manufacturer": "Google",
      "bits": 32
    },
    "engine": {
      "name": "Blink",
      "version": "537.36.0",
      "manufacturer": "Google"
    }
  }
]