[
  {
    "headers": {
      "user-agent": "UCWEB/2.0 (Linux; U; Opera Mini/7.1.32052/30.3697; ru; S-TELL_M260) U2/1.0.0 UCBrowser/10.1.2.571 Mobile"
    },
    "device": {
      "deviceName": "M260",
      "marketingName": "M260",
      "manufacturer": "Stell",
      "brand": "Stell",
      "display": {
        "width": 480,
        "height": 800,
        "touch": true,
        "type": "WVGA (variant 3)",
        "size": null
      },
      "dualOrientation": true,
      "type": "smartphone",
      "simCount": 0,
      "market": {
        "regions": [],
        "countries": [],
        "vendors": []
      },
      "connections": []
    },
    "browser": {
      "name": "UC Browser",
      "modus": null,
      "version": "10.1.2.571",
      "manufacturer": "UcWeb",
      "bits": 32,
      "type": "transcoder"
    },
    "os": {
      "name": "Android",
      "marketingName": "Android",
      "version": "0.0.0",
      "manufacturer": "Google",
      "bits": 32
    },
    "engine": {
      "name": "U2",
      "version": "1.0.0",
      "manufacturer": "UcWeb"
    }
  }
]
