[
  {
    "headers": {
      "user-agent": "Mozilla/5.0 (Linux; Android 7.0; F888 Build/NRD90M; wv) AppleWebKit/537.36 (KHTML, like Gecko) Version/4.0 Chrome/70.0.3538.80 Safari/537.36"
    },
    "device": {
      "deviceName": "F888",
      "marketingName": "F888",
      "manufacturer": "Ouku",
      "brand": "Ouku",
      "display": {
        "width": 1280,
        "height": 800,
        "touch": true,
        "type": "unknown"
      },
      "dualOrientation": true,
      "type": "fone-pad"
    },
    "browser": {
      "name": "Android WebView",
      "modus": null,
      "version": "70.0.3538.80",
      "manufacturer": "Google",
      "bits": 32,
      "type": "browser"
    },
    "os": {
      "name": "Android",
      "marketingName": "Android",
      "version": "7.0.0",
      "manufacturer": "Google",
      "bits": 32
    },
    "engine": {
      "name": "Blink",
      "version": "537.36.0",
      "manufacturer": "Google"
    }
  }
]
