[
  {
    "headers": {
      "user-agent": "Mozilla/5.0 (Linux; Android 4.4.2; QT-10 Build/KOT49H) AppleWebKit/537.36 (KHTML, like Gecko) Version/4.0 Chrome/30.0.0.0 Safari/537.36"
    },
    "device": {
      "deviceName": "QT-10",
      "marketingName": "QT-10",
      "manufacturer": "Qmax",
      "brand": "Qmax",
      "display": {
        "width": null,
        "height": null,
        "touch": false,
        "type": "unknown",
        "size": null
      },
      "dualOrientation": false,
      "type": "tv-media-player",
      "simCount": 0,
      "market": {
        "regions": [],
        "countries": [],
        "vendors": []
      },
      "connections": []
    },
    "browser": {
      "name": "Android WebView",
      "modus": null,
      "version": "30.0.0.0",
      "manufacturer": "Google",
      "bits": 32,
      "type": "browser"
    },
    "os": {
      "name": "Android",
      "marketingName": "Android",
      "version": "4.4.2",
      "manufacturer": "Google",
      "bits": 32
    },
    "engine": {
      "name": "Blink",
      "version": "537.36.0",
      "manufacturer": "Google"
    }
  }
]
