[
  {
    "headers": {
      "user-agent": "Mozilla/5.0 (Linux; U; Android 4.0.4; en-us; N9500 Build/IMM76I) AppleWebKit/534.30 (KHTML, like Gecko) Version/4.0 Mobile Safari/534.30"
    },
    "device": {
      "deviceName": "N9500",
      "marketingName": "N9500",
      "manufacturer": "Star",
      "brand": "Star",
      "type": "smartphone",
      "display": {
        "width": 720,
        "height": 1280,
        "touch": true,
        "type": null
      },
      "dualOrientation": true
    },
    "browser": {
      "name": "Android Webkit",
      "modus": null,
      "version": "4.0.0",
      "manufacturer": "Google",
      "bits": 32,
      "type": "browser"
    },
    "os": {
      "name": "Android",
      "marketingName": "Android",
      "version": "4.0.4",
      "manufacturer": "Google",
      "bits": 32
    },
    "engine": {
      "name": "WebKit",
      "version": "534.30.0",
      "manufacturer": "Apple"
    }
  },
  {
    "headers": {
      "user-agent": "UCWEB/2.0 (MIDP-2.0; U; Adr 4.3.3; ru; GT-9000) U2/1.0.0 UCBrowser/9.9.0.543 U2/1.0.0 Mobile"
    },
    "device": {
      "deviceName": "GT-9000",
      "marketingName": "H5W",
      "manufacturer": "Star",
      "brand": "Star",
      "type": "smartphone",
      "display": {
        "width": 480,
        "height": 800,
        "touch": true,
        "type": null
      },
      "dualOrientation": true
    },
    "browser": {
      "name": "UC Browser",
      "modus": null,
      "version": "9.9.0.543",
      "manufacturer": "UcWeb",
      "bits": 32,
      "type": "transcoder"
    },
    "os": {
      "name": "Android",
      "marketingName": "Android",
      "version": "4.3.3",
      "manufacturer": "Google",
      "bits": 32
    },
    "engine": {
      "name": "U2",
      "version": "1.0.0",
      "manufacturer": "UcWeb"
    }
  },
  {
    "headers": {
      "user-agent": "Mozilla/5.0 (Linux; Android 4.2.2; N8000 Build/JDQ39) AppleWebKit/537.36 (KHTML, like Gecko) Chrome/40.0.2214.115 YaBrowser/15.2.2214.3725.01 Safari/537.36"
    },
    "device": {
      "deviceName": "N8000",
      "marketingName": "Note 3",
      "manufacturer": "Star",
      "brand": "Star",
      "type": "smartphone",
      "display": {
        "width": 540,
        "height": 960,
        "touch": true,
        "type": null
      },
      "dualOrientation": true
    },
    "browser": {
      "name": "Yandex Browser",
      "modus": null,
      "version": "15.2.2214.3725.01",
      "manufacturer": "Yandex",
      "bits": 32,
      "type": "browser"
    },
    "os": {
      "name": "Android",
      "marketingName": "Android",
      "version": "4.2.2",
      "manufacturer": "Google",
      "bits": 32
    },
    "engine": {
      "name": "Blink",
      "version": "537.36.0",
      "manufacturer": "Google"
    }
  },
  {
    "headers": {
      "user-agent": "Mozilla/5.0 (Linux; Android 4.2.1; 9930i Build/JOP40D) AppleWebKit/537.36 (KHTML, like Gecko) Chrome/30.0.1599.92 Mobile Safari/537.36"
    },
    "device": {
      "deviceName": "9930i",
      "marketingName": "Galaxy S3",
      "manufacturer": "Star",
      "brand": "Star",
      "type": "smartphone",
      "display": {
        "width": 480,
        "height": 854,
        "touch": true,
        "type": null
      },
      "dualOrientation": true
    },
    "browser": {
      "name": "Chrome",
      "modus": null,
      "version": "30.0.1599.92",
      "manufacturer": "Google",
      "bits": 32,
      "type": "browser"
    },
    "os": {
      "name": "Android",
      "marketingName": "Android",
      "version": "4.2.1",
      "manufacturer": "Google",
      "bits": 32
    },
    "engine": {
      "name": "Blink",
      "version": "537.36.0",
      "manufacturer": "Google"
    }
  },
  {
    "headers": {
      "user-agent": "Mozilla/5.0 (Linux; Android 4.2.2; N8800 Build/JDQ39) AppleWebKit/537.36 (KHTML, like Gecko) Chrome/43.0.2357.92 Mobile Safari/537.36"
    },
    "device": {
      "deviceName": "N8800",
      "marketingName": "N8800",
      "manufacturer": "Star",
      "brand": "Star",
      "type": "smartphone",
      "display": {
        "width": 540,
        "height": 960,
        "touch": true,
        "type": null
      },
      "dualOrientation": true
    },
    "browser": {
      "name": "Chrome",
      "modus": null,
      "version": "43.0.2357.92",
      "manufacturer": "Google",
      "bits": 32,
      "type": "browser"
    },
    "os": {
      "name": "Android",
      "marketingName": "Android",
      "version": "4.2.2",
      "manufacturer": "Google",
      "bits": 32
    },
    "engine": {
      "name": "Blink",
      "version": "537.36.0",
      "manufacturer": "Google"
    }
  },
  {
    "headers": {
      "user-agent": "Mozilla/5.0 (Linux; U; Android 4.2.1; fr-fr; N9600 Build/JOP40D) AppleWebKit/534.30 (KHTML, like Gecko) Version/4.0 Mobile Safari/534.30"
    },
    "device": {
      "deviceName": "N9600",
      "marketingName": "N9600",
      "manufacturer": "Star",
      "brand": "Star",
      "type": "smartphone",
      "display": {
        "width": null,
        "height": null,
        "touch": true,
        "type": null
      },
      "dualOrientation": true
    },
    "browser": {
      "name": "Android Webkit",
      "modus": null,
      "version": "4.0.0",
      "manufacturer": "Google",
      "bits": 32,
      "type": "browser"
    },
    "os": {
      "name": "Android",
      "marketingName": "Android",
      "version": "4.2.1",
      "manufacturer": "Google",
      "bits": 32
    },
    "engine": {
      "name": "WebKit",
      "version": "534.30.0",
      "manufacturer": "Apple"
    }
  },
  {
    "headers": {
      "user-agent": "Mozilla/5.0 (Linux; Android 4.2.2; N9700 Build/JDQ39) AppleWebKit/537.36 (KHTML, like Gecko) Chrome/34.0.1847.114 Mobile Safari/537.36"
    },
    "device": {
      "deviceName": "N9700",
      "marketingName": "N9700",
      "manufacturer": "Star",
      "brand": "Star",
      "type": "smartphone",
      "display": {
        "width": 540,
        "height": 960,
        "touch": true,
        "type": null
      },
      "dualOrientation": true
    },
    "browser": {
      "name": "Chrome",
      "modus": null,
      "version": "34.0.1847.114",
      "manufacturer": "Google",
      "bits": 32,
      "type": "browser"
    },
    "os": {
      "name": "Android",
      "marketingName": "Android",
      "version": "4.2.2",
      "manufacturer": "Google",
      "bits": 32
    },
    "engine": {
      "name": "Blink",
      "version": "537.36.0",
      "manufacturer": "Google"
    }
  },
  {
    "headers": {
      "user-agent": "Mozilla/5.0 (Linux; U; Android 4.2.2; it-it; N9800 Build/JDQ39) AppleWebKit/534.30 (KHTML, like Gecko) Version/4.0 Mobile Safari/534.30"
    },
    "device": {
      "deviceName": "N9800",
      "marketingName": "N9800",
      "manufacturer": "Star",
      "brand": "Star",
      "type": "smartphone",
      "display": {
        "width": 720,
        "height": 1280,
        "touch": true,
        "type": null
      },
      "dualOrientation": true
    },
    "browser": {
      "name": "Android Webkit",
      "modus": null,
      "version": "4.0.0",
      "manufacturer": "Google",
      "bits": 32,
      "type": "browser"
    },
    "os": {
      "name": "Android",
      "marketingName": "Android",
      "version": "4.2.2",
      "manufacturer": "Google",
      "bits": 32
    },
    "engine": {
      "name": "WebKit",
      "version": "534.30.0",
      "manufacturer": "Apple"
    }
  },
  {
    "headers": {
      "user-agent": "Mozilla/5.0 (Linux; U; Android 4.1.1; fr-fr; N9977 Build/JRO03C) AppleWebKit/534.30 (KHTML, like Gecko) Version/4.0 Mobile Safari/534.30"
    },
    "device": {
      "deviceName": "N9977",
      "marketingName": "Note 2",
      "manufacturer": "Star",
      "brand": "Star",
      "type": "smartphone",
      "display": {
        "width": 480,
        "height": 800,
        "touch": true,
        "type": null
      },
      "dualOrientation": true
    },
    "browser": {
      "name": "Android Webkit",
      "modus": null,
      "version": "4.0.0",
      "manufacturer": "Google",
      "bits": 32,
      "type": "browser"
    },
    "os": {
      "name": "Android",
      "marketingName": "Android",
      "version": "4.1.1",
      "manufacturer": "Google",
      "bits": 32
    },
    "engine": {
      "name": "WebKit",
      "version": "534.30.0",
      "manufacturer": "Apple"
    }
  },
  {
    "headers": {
      "user-agent": "Mozilla/5.0 (Linux; Android 4.4.2; N9000 Build/KOT49H) AppleWebKit/537.36 (KHTML, like Gecko) Version/4.0 Chrome/30.0.0.0 Mobile Safari/537.36"
    },
    "device": {
      "deviceName": "N9000",
      "marketingName": "Note 3 III",
      "manufacturer": "Star",
      "brand": "Star",
      "type": "smartphone",
      "display": {
        "width": null,
        "height": null,
        "touch": true,
        "type": null
      },
      "dualOrientation": true
    },
    "browser": {
      "name": "Android WebView",
      "modus": null,
      "version": "30.0.0.0",
      "manufacturer": "Google",
      "bits": 32,
      "type": "browser"
    },
    "os": {
      "name": "Android",
      "marketingName": "Android",
      "version": "4.4.2",
      "manufacturer": "Google",
      "bits": 32
    },
    "engine": {
      "name": "Blink",
      "version": "537.36.0",
      "manufacturer": "Google"
    }
  }
]