[
  {
    "headers": {
      "user-agent": "Mozilla/5.0 (Linux; U; Android 4.0; zh-CN; NOAIN A900S Build/GRK39F) AppleWebKit/534.30 (KHTML, like Gecko) Version/4.0 UCBrowser/10.3.2.559 U3/0.8.0 Mobile Safari/534.30"
    },
    "device": {
      "deviceName": "A900S",
      "marketingName": "A900S",
      "manufacturer": "Noain",
      "brand": "Noain",
      "type": "smartphone",
      "display": {
        "width": 480,
        "height": 800,
        "touch": true,
        "type": null
      },
      "dualOrientation": false
    },
    "browser": {
      "name": "UC Browser",
      "modus": null,
      "version": "10.3.2.559",
      "manufacturer": "UcWeb",
      "bits": 32,
      "type": "transcoder"
    },
    "os": {
      "name": "Android",
      "marketingName": "Android",
      "version": "4.0.0",
      "manufacturer": "Google",
      "bits": 32
    },
    "engine": {
      "name": "U3",
      "version": "0.8.0",
      "manufacturer": "UcWeb"
    }
  },
  {
    "headers": {
      "user-agent": "Mozilla/5.0 (Linux; U; Android 4.2.2; zh-cn; NOAIN A913 Build/NOAINNOAIN) AppleWebKit/534.30 (KHTML, like Gecko) Version/4.0 Mobile Safari/534.30 baiduboxapp/042_0.4_diordna_458_084/NIAON_71_2.2.4_319A+NIAON/1000418d/E29E98703F45BF1A99367DD1C0738595%7C836550000196968/1"
    },
    "device": {
      "deviceName": "A913",
      "marketingName": "A913",
      "manufacturer": "Noain",
      "brand": "Noain",
      "type": "smartphone",
      "display": {
        "width": 720,
        "height": 1280,
        "touch": true,
        "type": null
      },
      "dualOrientation": false
    },
    "browser": {
      "name": "Baidu Box App",
      "modus": null,
      "version": "042.0.4",
      "manufacturer": "Baidu",
      "bits": 32,
      "type": "application"
    },
    "os": {
      "name": "Android",
      "marketingName": "Android",
      "version": "4.2.2",
      "manufacturer": "Google",
      "bits": 32
    },
    "engine": {
      "name": "WebKit",
      "version": "534.30.0",
      "manufacturer": "Apple"
    }
  },
  {
    "headers": {
      "user-agent": "Mozilla/5.0 (Linux; U; Android 4.4.4; zh-CN; NOAIN_M15 Build/KTU84P) AppleWebKit/534.30 (KHTML, like Gecko) Version/4.0 UCBrowser/10.2.0.535 U3/0.8.0 Mobile Safari/534.30"
    },
    "device": {
      "deviceName": "M15",
      "marketingName": "M15",
      "manufacturer": "Noain",
      "brand": "Noain",
      "type": "smartphone",
      "display": {
        "width": 720,
        "height": 1280,
        "touch": true,
        "type": null
      },
      "dualOrientation": false
    },
    "browser": {
      "name": "UC Browser",
      "modus": null,
      "version": "10.2.0.535",
      "manufacturer": "UcWeb",
      "bits": 32,
      "type": "transcoder"
    },
    "os": {
      "name": "Android",
      "marketingName": "Android",
      "version": "4.4.4",
      "manufacturer": "Google",
      "bits": 32
    },
    "engine": {
      "name": "U3",
      "version": "0.8.0",
      "manufacturer": "UcWeb"
    }
  },
  {
    "headers": {
      "user-agent": "Mozilla/5.0 (Linux; U; Android 4.2.2; zh-CN; NOAIN M6 Build/JDQ39) AppleWebKit/534.30 (KHTML, like Gecko) Version/4.0 UCBrowser/10.5.2.598 U3/0.8.0 Mobile Safari/534.30"
    },
    "device": {
      "deviceName": "M6",
      "marketingName": "M6",
      "manufacturer": "Noain",
      "brand": "Noain",
      "type": "smartphone",
      "display": {
        "width": 480,
        "height": 854,
        "touch": true,
        "type": null
      },
      "dualOrientation": false
    },
    "browser": {
      "name": "UC Browser",
      "modus": null,
      "version": "10.5.2.598",
      "manufacturer": "UcWeb",
      "bits": 32,
      "type": "transcoder"
    },
    "os": {
      "name": "Android",
      "marketingName": "Android",
      "version": "4.2.2",
      "manufacturer": "Google",
      "bits": 32
    },
    "engine": {
      "name": "U3",
      "version": "0.8.0",
      "manufacturer": "UcWeb"
    }
  }
]