[
  {
    "headers": {
      "user-agent": "Mozilla/5.0 (Linux; U; Android 2.3.3; ja-jp; COOLPIX S800c Build/CP01_WW) AppleWebKit/533.1 (KHTML, like Gecko) Version/4.0 Mobile Safari/533.1"
    },
    "device": {
      "deviceName": "Coolpix S800c",
      "marketingName": "Coolpix S800c",
      "manufacturer": "Nikon",
      "brand": "Nikon",
      "display": {
        "width": 480,
        "height": 800,
        "touch": true,
        "type": "WVGA (variant 3)",
        "size": null
      },
      "dualOrientation": true,
      "type": "digital-camera",
      "simCount": 0,
      "market": {
        "regions": [],
        "countries": [],
        "vendors": []
      },
      "connections": []
    },
    "browser": {
      "name": "Android Webkit",
      "modus": null,
      "version": "4.0.0",
      "manufacturer": "Google",
      "bits": 32,
      "type": "browser"
    },
    "os": {
      "name": "Android",
      "marketingName": "Android",
      "version": "2.3.3",
      "manufacturer": "Google",
      "bits": 32
    },
    "engine": {
      "name": "WebKit",
      "version": "533.1.0",
      "manufacturer": "Apple"
    }
  }
]
