[
  {
    "headers": {
      "user-agent": "Mozilla/5.0 (Linux; U; Android 2.3.1; en-us; pandigitalsprnova1/sourceidDL00000025) AppleWebKit/533.1 (KHTML, like Gecko) Version/4.0 Mobile Safari/533.1"
    },
    "device": {
      "deviceName": "SuperNova",
      "marketingName": "SuperNova",
      "manufacturer": "Pandigital",
      "brand": "Pandigital",
      "type": "tablet",
      "display": {
        "width": 800,
        "height": 600,
        "touch": true,
        "type": null
      },
      "dualOrientation": true
    },
    "browser": {
      "name": "Android Webkit",
      "modus": null,
      "version": "4.0.0",
      "manufacturer": "Google",
      "bits": 32,
      "type": "browser"
    },
    "os": {
      "name": "Android",
      "marketingName": "Android",
      "version": "2.3.1",
      "manufacturer": "Google",
      "bits": 32
    },
    "engine": {
      "name": "WebKit",
      "version": "533.1.0",
      "manufacturer": "Apple"
    }
  },
  {
    "headers": {
      "user-agent": "Mozilla/5.0 (Linux; U; Android Eclair; md-us Build/pandigitalopc1/sourceidDL00000009) AppleWebKit/530.17 (KHTML, like Gecko) Version/4.0 Mobile Safari/530.17"
    },
    "device": {
      "deviceName": "Novel",
      "marketingName": "Novel",
      "manufacturer": "Pandigital",
      "brand": "Pandigital",
      "type": "tablet",
      "display": {
        "width": 800,
        "height": 600,
        "touch": true,
        "type": null
      },
      "dualOrientation": true
    },
    "browser": {
      "name": "Android Webkit",
      "modus": null,
      "version": "4.0.0",
      "manufacturer": "Google",
      "bits": 32,
      "type": "browser"
    },
    "os": {
      "name": "Android",
      "marketingName": "Android",
      "version": "2.1.0",
      "manufacturer": "Google",
      "bits": 32
    },
    "engine": {
      "name": "WebKit",
      "version": "530.17.0",
      "manufacturer": "Apple"
    }
  },
  {
    "headers": {
      "user-agent": "Mozilla/5.0 (Linux; U; Android 2.0; en-us; pandigital9hr) AppleWebKit/530.17 (KHTML, like Gecko) Version/4.0 Mobile Safari/530.17"
    },
    "device": {
      "deviceName": "9hr",
      "marketingName": "9hr",
      "manufacturer": "Pandigital",
      "brand": "Pandigital",
      "type": "tablet",
      "display": {
        "width": null,
        "height": null,
        "touch": true,
        "type": null
      },
      "dualOrientation": true
    },
    "browser": {
      "name": "Android Webkit",
      "modus": null,
      "version": "4.0.0",
      "manufacturer": "Google",
      "bits": 32,
      "type": "browser"
    },
    "os": {
      "name": "Android",
      "marketingName": "Android",
      "version": "2.0.0",
      "manufacturer": "Google",
      "bits": 32
    },
    "engine": {
      "name": "WebKit",
      "version": "530.17.0",
      "manufacturer": "Apple"
    }
  }
]