[
  {
    "headers": {
      "user-agent": "Mozilla/5.0 (Linux; Android 4.4.2; Doro Liberto 820 Mini Build/KOT49H) AppleWebKit/537.36 (KHTML, like Gecko) Chrome/40.0.2214.109 Mobile Safari/537.36"
    },
    "device": {
      "deviceName": "Liberto 820 Mini",
      "marketingName": "Liberto 820 Mini",
      "manufacturer": "Doro",
      "brand": "Doro",
      "display": {
        "width": 480,
        "height": 800,
        "touch": true,
        "type": "WVGA (variant 3)",
        "size": null
      },
      "dualOrientation": true,
      "type": "smartphone",
      "simCount": 0,
      "market": {
        "regions": [],
        "countries": [],
        "vendors": []
      },
      "connections": []
    },
    "browser": {
      "name": "Chrome",
      "modus": null,
      "version": "40.0.2214.109",
      "manufacturer": "Google",
      "bits": 32,
      "type": "browser"
    },
    "os": {
      "name": "Android",
      "marketingName": "Android",
      "version": "4.4.2",
      "manufacturer": "Google",
      "bits": 32
    },
    "engine": {
      "name": "Blink",
      "version": "537.36.0",
      "manufacturer": "Google"
    }
  },
  {
    "headers": {
      "user-agent": "Mozilla/5.0 (Linux; Android 5.1.1; Doro 8030/8031/8028 Build/EU_RET_03.14.02; wv) AppleWebKit/537.36 (KHTML, like Gecko) Version/4.0 Chrome/58.0.3029.83 Mobile Safari/537.36"
    },
    "device": {
      "deviceName": "8030",
      "marketingName": "8030",
      "manufacturer": "Doro",
      "brand": "Doro",
      "display": {
        "width": 480,
        "height": 854,
        "touch": true,
        "type": "FWVGA (variant 1)",
        "size": null
      },
      "dualOrientation": true,
      "type": "smartphone",
      "simCount": 0,
      "market": {
        "regions": [],
        "countries": [],
        "vendors": []
      },
      "connections": []
    },
    "browser": {
      "name": "Android WebView",
      "modus": null,
      "version": "58.0.3029.83",
      "manufacturer": "Google",
      "bits": 32,
      "type": "browser"
    },
    "os": {
      "name": "Android",
      "marketingName": "Android",
      "version": "5.1.1",
      "manufacturer": "Google",
      "bits": 32
    },
    "engine": {
      "name": "Blink",
      "version": "537.36.0",
      "manufacturer": "Google"
    }
  },
  {
    "headers": {
      "user-agent": "Mozilla/5.0 (Linux; Android 5.1.1; Doro Liberto 825 Build/EU_RET_04.10.00; wv) AppleWebKit/537.36 (KHTML, like Gecko) Version/4.0 Chrome/55.0.2883.91 Mobile Safari/537.36"
    },
    "device": {
      "deviceName": "Liberto 825",
      "marketingName": "Liberto 825",
      "manufacturer": "Doro",
      "brand": "Doro",
      "display": {
        "width": 720,
        "height": 1280,
        "touch": true,
        "type": "HD/WXGA",
        "size": null
      },
      "dualOrientation": true,
      "type": "smartphone",
      "simCount": 0,
      "market": {
        "regions": [],
        "countries": [],
        "vendors": []
      },
      "connections": []
    },
    "browser": {
      "name": "Android WebView",
      "modus": null,
      "version": "55.0.2883.91",
      "manufacturer": "Google",
      "bits": 32,
      "type": "browser"
    },
    "os": {
      "name": "Android",
      "marketingName": "Android",
      "version": "5.1.1",
      "manufacturer": "Google",
      "bits": 32
    },
    "engine": {
      "name": "Blink",
      "version": "537.36.0",
      "manufacturer": "Google"
    }
  },
  {
    "headers": {
      "user-agent": "Mozilla/5.0 (Linux; Android 4.4.2; Doro Liberto 820 Build/KOT49H) AppleWebKit/537.36 (KHTML, like Gecko) Chrome/41.0.2272.94 Mobile Safari/537.36"
    },
    "device": {
      "deviceName": "Liberto 820",
      "marketingName": "Liberto 820",
      "manufacturer": "Doro",
      "brand": "Doro",
      "display": {
        "width": 540,
        "height": 960,
        "touch": true,
        "type": "qHD",
        "size": null
      },
      "dualOrientation": true,
      "type": "smartphone",
      "simCount": 0,
      "market": {
        "regions": [],
        "countries": [],
        "vendors": []
      },
      "connections": []
    },
    "browser": {
      "name": "Chrome",
      "modus": null,
      "version": "41.0.2272.94",
      "manufacturer": "Google",
      "bits": 32,
      "type": "browser"
    },
    "os": {
      "name": "Android",
      "marketingName": "Android",
      "version": "4.4.2",
      "manufacturer": "Google",
      "bits": 32
    },
    "engine": {
      "name": "Blink",
      "version": "537.36.0",
      "manufacturer": "Google"
    }
  },
  {
    "headers": {
      "user-agent": "Mozilla/5.0 (Linux; Android 5.1.1; Doro 8031 Build/EU_TMO_02.19.00) AppleWebKit/537.36 (KHTML, like Gecko) Chrome/68.0.3440.91 Mobile Safari/537.36"
    },
    "device": {
      "deviceName": "8031",
      "marketingName": "8031",
      "manufacturer": "Doro",
      "brand": "Doro",
      "display": {
        "width": 480,
        "height": 854,
        "touch": true,
        "type": "FWVGA (variant 1)",
        "size": null
      },
      "dualOrientation": true,
      "type": "smartphone",
      "simCount": 0,
      "market": {
        "regions": [],
        "countries": [],
        "vendors": []
      },
      "connections": []
    },
    "browser": {
      "name": "Chrome",
      "modus": null,
      "version": "68.0.3440.91",
      "manufacturer": "Google",
      "bits": 32,
      "type": "browser"
    },
    "os": {
      "name": "Android",
      "marketingName": "Android",
      "version": "5.1.1",
      "manufacturer": "Google",
      "bits": 32
    },
    "engine": {
      "name": "Blink",
      "version": "537.36.0",
      "manufacturer": "Google"
    }
  },
  {
    "headers": {
      "user-agent": "Mozilla/5.0 (Linux; Android 7.0; Doro 8040 Build/S10A_502) AppleWebKit/537.36 (KHTML, like Gecko) Chrome/64.0.3282.137 Mobile Safari/537.36"
    },
    "device": {
      "deviceName": "8040",
      "marketingName": "8040",
      "manufacturer": "Doro",
      "brand": "Doro",
      "display": {
        "width": null,
        "height": null,
        "touch": true,
        "type": "unknown",
        "size": null
      },
      "dualOrientation": true,
      "type": "smartphone",
      "simCount": 0,
      "market": {
        "regions": [],
        "countries": [],
        "vendors": []
      },
      "connections": []
    },
    "browser": {
      "name": "Chrome",
      "modus": null,
      "version": "64.0.3282.137",
      "manufacturer": "Google",
      "bits": 32,
      "type": "browser"
    },
    "os": {
      "name": "Android",
      "marketingName": "Android",
      "version": "7.0.0",
      "manufacturer": "Google",
      "bits": 32
    },
    "engine": {
      "name": "Blink",
      "version": "537.36.0",
      "manufacturer": "Google"
    }
  }
]
