[
  {
    "headers": {
      "user-agent": "Mozilla/5.0 (Linux; U; Android 4.2.2; ru; Impress_L Build/JDQ39) AppleWebKit/528.5+ (KHTML, like Gecko) Version/3.1.2 Mobile Safari/525.20.1 UCBrowser/9.5.1.494 Mobile"
    },
    "device": {
      "deviceName": "Impress L",
      "marketingName": "Impress L",
      "manufacturer": "Vertex",
      "brand": "Vertex",
      "display": {
        "width": 540,
        "height": 960,
        "touch": true,
        "type": "qHD",
        "size": null
      },
      "dualOrientation": true,
      "type": "smartphone",
      "simCount": 0,
      "market": {
        "regions": [],
        "countries": [],
        "vendors": []
      },
      "connections": []
    },
    "browser": {
      "name": "UC Browser",
      "modus": null,
      "version": "9.5.1.494",
      "manufacturer": "UcWeb",
      "bits": 32,
      "type": "transcoder"
    },
    "os": {
      "name": "Android",
      "marketingName": "Android",
      "version": "4.2.2",
      "manufacturer": "Google",
      "bits": 32
    },
    "engine": {
      "name": "WebKit",
      "version": "528.5.0",
      "manufacturer": "Apple"
    }
  }
]
